colonizer,paragraph
britain,"Great Britain established the largest and most influential colonial empire in modern history. Driven by trade, naval power, and industrial expansion, it built colonies and dominions across North America, the Caribbean, Africa, Asia, and Oceania. British colonial rule combined economic exploitation with the spread of political institutions and the English language, shaping global governance and commerce."
belgium,"Belgium entered the colonial race in the late 19th century under King Leopold II. Its colonial rule was centered on the Congo Free State, initially the king’s private possession before becoming a Belgian colony in 1908. Belgian administration was marked by intense economic exploitation and humanitarian abuses, particularly in rubber and ivory extraction, which sparked international criticism."
netherlands,"The Netherlands built a maritime empire centered on trade rather than conquest. Through the Dutch East India Company (VOC), it established dominance in Indonesia, the Caribbean, and parts of South America. Dutch colonialism prioritized commercial monopolies and naval control over settlement."
france,"France developed a vast colonial empire, motivated by economic ambition and the spread of French culture. It held territories in North America, the Caribbean, Africa, and Asia. The French colonial model emphasized centralized administration and cultural assimilation through the mission civilisatrice, aiming to extend French civilization abroad."
spain,"Spain was the first European power to build a global colonial empire after 1492. It dominated much of the Americas, the Caribbean, and parts of Asia. Spanish colonialism was characterized by conquest, conversion to Christianity, and strong centralized control through imperial councils and trade monopolies."
portugal,"Portugal pioneered European overseas expansion in the 15th century. Using its naval strength, it established trading posts and colonies along the coasts of Africa, Asia, and South America, notably in Brazil, Angola, Mozambique, Goa, and Macau. Portuguese colonialism focused on commerce and maritime dominance."
germany,"Germany joined the colonial competition during the late 19th century’s Scramble for Africa. It acquired territories in Africa, modern Namibia, Tanzania, Cameroon, and Togo, and islands in the Pacific. German colonial rule was often harsh and short-lived, ending with World War I."
italy,"Italy entered the colonial race in the late 19th century to assert itself as a major European power. It established colonies in Eritrea, Somalia, Libya, and briefly Ethiopia. Italian colonial policy was driven more by national prestige than by economic goals and ended after World War II."